ETF_TICKER,ETF_NAME,INDEX_NAME,CAPE,FWD_RETURN_5Y_FORECAST,LOWER_CONFIDENCE,UPPER_CONFIDENCE,INDEX_TICKER
KBWB,Invesco KBW Bank ETF,KBW Bank,12.54,0.0048,-0.1647,0.1749,BKX
ONEQ,Fidelity Nasdaq Composite Index ETF,NASDAQ Composite,34.11,0.1065,0.0102,0.2043,CCMP
DVY,iShares Select Dividend ETF,Dow Jones Select Dividend,14.08,0.0443,-0.0816,0.1707,DJDVP
BBRE,JPMorgan BetaBuilders MSCI US REIT ETF,Dow Jones US Select Real Estate Securities,45.86,0.0108,-0.1108,0.1315,DWRSF
FRI,First Trust S&P REIT Index Fund,Dow Jones US Select Real Estate Securities,45.86,0.0108,-0.1108,0.1315,DWRSF
RWR,SPDR Dow Jones REIT ETF,Dow Jones US Select Real Estate Securities,45.86,0.0108,-0.1108,0.1315,DWRSF
USRT,iShares Core US REIT ETF,Dow Jones US Select Real Estate Securities,45.86,0.0108,-0.1108,0.1315,DWRSF
DIA,SPDR Dow Jones Industrial Average ETF Trust,Dow Jones Industrial Average,23.74,0.029,-0.0684,0.127,INDU
IYW,iShares US Technology ETF,NASDAQ Computer,39.59,0.1136,-0.0133,0.2422,IXK
FTEC,Fidelity MSCI Information Technology Index ETF,Technology Select Sector,37.94,0.0552,-0.0929,0.2252,IXT
XLK,Technology Select Sector SPDR Fund,Technology Select Sector,37.94,0.0552,-0.0929,0.2252,IXT
VGT,Vanguard Information Technology ETF,Technology Select Sector,37.94,0.0552,-0.0929,0.2252,IXT
IVOO,Vanguard S&P Mid-Cap 400 ETF,S&P Midcap 400,21.85,0.1046,0.0406,0.1686,MID
IJH,iShares Core S&P Mid-Cap ETF,S&P Midcap 400,21.85,0.1046,0.0406,0.1686,MID
MDY,SPDR S&P MidCap 400 ETF Trust,S&P Midcap 400,21.85,0.1046,0.0406,0.1686,MID
SPMD,SPDR Portfolio S&P 400 Mid Cap ETF,S&P Midcap 400,21.85,0.1046,0.0406,0.1686,MID
IJK,iShares S&P Mid-Cap 400 Growth ETF,S&P MidCap 400 Growth,30.89,0.1042,0.038,0.169,MIDG
MDYG,SPDR S&P 400 Mid CapGrowth ETF,S&P MidCap 400 Growth,30.89,0.1042,0.038,0.169,MIDG
IJJ,iShares S&P Mid-Cap 400 Value ETF,S&P Midcap 400 Value,17.38,0.0848,0.0178,0.153,MIDV
IVOV,Vanguard S&P Mid-Cap 400 Value ETF,S&P Midcap 400 Value,17.38,0.0848,0.0178,0.153,MIDV
MDYV,SPDR S&P 400 Mid Cap Value ETF,S&P Midcap 400 Value,17.38,0.0848,0.0178,0.153,MIDV
ACWI,iShares MSCI ACWI ETF,MSCI World USD,24.23,0.0202,-0.0664,0.1075,MSDUWI
CRBN,iShares MSCI ACWI Low Carbon Target ETF,MSCI World USD,24.23,0.0202,-0.0664,0.1075,MSDUWI
KOKU,Xtrackers MSCI Kokusai Equity ETF,MSCI World USD,24.23,0.0202,-0.0664,0.1075,MSDUWI
TOK,iShares MSCI Kokusai ETF,MSCI World USD,24.23,0.0202,-0.0664,0.1075,MSDUWI
URTH,iShares MSCI World ETF,MSCI World USD,24.23,0.0202,-0.0664,0.1075,MSDUWI
VT,Vanguard Total World Stock ETF,MSCI World USD,24.23,0.0202,-0.0664,0.1075,MSDUWI
IXC,iShares Global Energy ETF,MSCI KOKUSAI Energy,23.99,0.0492,-0.0931,0.1919,MXKO0EN
PBSM,Invesco PureBeta MSCI USA Small Cap ETF,MSCI North America Small Cap,20.22,0.093,0.023,0.1639,MXNASC
FDIS,Fidelity MSCI Consumer Discretionary Index ETF,MSCI USA Consumer Discretionary,35.3,0.0445,-0.1182,0.2077,MXUS0CD
FSTA,Fidelity MSCI Consumer Staples Index ETF,MSCI USA Consumer Staples,24.03,0.0371,-0.0415,0.1158,MXUS0CS
VDC,Vanguard Consumer Staples ETF,MSCI USA Consumer Staples,24.03,0.0371,-0.0415,0.1158,MXUS0CS
FENY,Fidelity MSCI Energy Index ETF,MSCI USA Energy,25.61,0.0669,-0.0968,0.2304,MXUS0EN
IYE,iShares U.S. Energy ETF,MSCI USA Energy,25.61,0.0669,-0.0968,0.2304,MXUS0EN
XLE,Energy Select Sector SPDR Fund,MSCI USA Energy,25.61,0.0669,-0.0968,0.2304,MXUS0EN
VDE,Vanguard Energy ETF,MSCI USA Energy,25.61,0.0669,-0.0968,0.2304,MXUS0EN
FNCL,Fidelity MSCI Financials Index ETF,MSCI USA Financials,17.8,0.0233,-0.1524,0.1986,MXUS0FN
XLF,Financial Select Sector SPDR Fund,MSCI USA Financials,17.8,0.0233,-0.1524,0.1986,MXUS0FN
VFH,Vanguard Financials ETF,MSCI USA Financials,17.8,0.0233,-0.1524,0.1986,MXUS0FN
IYH,iShares U.S. Healthcare ETF,MSCI USA Health Care,30.87,0.0605,-0.052,0.1728,MXUS0HC
XLV,Health Care Select Sector SPDR Fund,MSCI USA Health Care,30.87,0.0605,-0.052,0.1728,MXUS0HC
FIDU,Fidelity MSCI Industrials Index ETF,MSCI USA Industrials,24.06,0.0537,-0.0619,0.1691,MXUS0IN
XLI,Industrial Select Sector SPDR Fund,MSCI USA Industrials,24.06,0.0537,-0.0619,0.1691,MXUS0IN
VIS,Vanguard Industrials ETF,MSCI USA Industrials,24.06,0.0537,-0.0619,0.1691,MXUS0IN
FMAT,Fidelity MSCI Materials Index ETF,MSCI USA Materials,20.28,0.055,-0.0133,0.1229,MXUS0MT
VAW,Vanguard Materials ETF,MSCI USA Materials,20.28,0.055,-0.0133,0.1229,MXUS0MT
XLB,Materials Select Sector SPDR Fund,MSCI USA Materials,20.28,0.055,-0.0133,0.1229,MXUS0MT
FUTY,Fidelity MSCI Utilities Index ETF,MSCI USA Utilities,19.28,-0.0033,-0.1068,0.1006,MXUS0UT
IDU,iShares US Utilities ETF,MSCI USA Utilities,19.28,-0.0033,-0.1068,0.1006,MXUS0UT
VPU,Vanguard Utilities ETF,MSCI USA Utilities,19.28,-0.0033,-0.1068,0.1006,MXUS0UT
XLU,Utilities Select Sector SPDR Fund,MSCI USA Utilities,19.28,-0.0033,-0.1068,0.1006,MXUS0UT
BKSE,BNY Mellon US Small Cap Core Equity ETF,MSCI United States Small Cap,20.14,0.099,0.0286,0.1686,MXUSSC
ESML,iShares ESG Aware MSCI USA Small-Cap ETF,MSCI United States Small Cap,20.14,0.099,0.0286,0.1686,MXUSSC
JHSC,John Hancock Multifactor Small Cap ETF,MSCI United States Small Cap,20.14,0.099,0.0286,0.1686,MXUSSC
NUSC,Nuveen ESG Small-Cap ETF,MSCI United States Small Cap,20.14,0.099,0.0286,0.1686,MXUSSC
SMMD,iShares Russell 2500 ETF,MSCI United States Small Cap,20.14,0.099,0.0286,0.1686,MXUSSC
VB,Vanguard Small-Cap ETF,MSCI United States Small Cap,20.14,0.099,0.0286,0.1686,MXUSSC
SCHA,Schwab US Small-Cap ETF,MSCI United States Small Cap,20.14,0.099,0.0286,0.1686,MXUSSC
IXN,iShares Global Tech ETF,MSCI ACWI Information Technology,35.56,0.0631,-0.0658,0.1923,MXWD0IT
QQQ,Invesco QQQ Trust Series 1,NASDAQ-100,36.31,0.1637,0.0826,0.2439,NDQ
BKLC,BNY Mellon US Large Cap Core Equity ETF,S&P 100,27.26,0.0128,-0.1036,0.1284,OEX
OEF,iShares S&P 100 ETF,S&P 100,27.26,0.0128,-0.1036,0.1284,OEX
XLG,Invesco Exchange-Traded Fund Trust-Invesco S&P 500r Top 50 ETF,S&P 100,27.26,0.0128,-0.1036,0.1284,OEX
OIH,VanEck Oil Services ETF,Philadelphia Stock Exchange Oil Service Sector,8.79,-0.1749,-0.4189,0.0686,OSX
ILCG,iShares Morningstar Growth ETF,Russell 3000 Growth,40.73,0.017,-0.1094,0.1428,RAG
VUG,Vanguard Growth ETF,Russell 3000 Growth,40.73,0.017,-0.1094,0.1428,RAG
IWP,iShares Russell Mid-Cap Growth ETF,Russell Midcap Growth,39.1,0.0587,-0.0442,0.1622,RDG
VOT,Vanguard Mid-Cap Growth ETF,Russell Midcap Growth,39.1,0.0587,-0.0442,0.1622,RDG
IWF,iShares Russell 1000 Growth ETF,Russell 1000 Growth,41.41,0.0132,-0.1173,0.1442,RLG
MGK,Vanguard Mega Cap Growth ETF,Russell 1000 Growth,41.41,0.0132,-0.1173,0.1442,RLG
SCHG,Schwab U.S. Large-Cap Growth ETF,Russell 1000 Growth,41.41,0.0132,-0.1173,0.1442,RLG
TMFC,Motley Fool 100 Index ETF,Russell 1000 Growth,41.41,0.0132,-0.1173,0.1442,RLG
VONG,Vanguard Russell 1000 Growth ETF,Russell 1000 Growth,41.41,0.0132,-0.1173,0.1442,RLG
IWD,iShares Russell 1000 Value ETF,Russell 1000 Value,20.16,0.0142,-0.0728,0.1005,RLV
SCHV,Schwab U.S. Large-Cap Value ETF,Russell 1000 Value,20.16,0.0142,-0.0728,0.1005,RLV
VONV,Vanguard Russell 1000 Value,Russell 1000 Value,20.16,0.0142,-0.0728,0.1005,RLV
IMCB,iShares Morningstar Mid-Cap ETF,Russell Midcap real-time,23.39,0.0618,-0.0139,0.1374,RMC
IWR,iShares Russell Mid-Cap ETF,Russell Midcap real-time,23.39,0.0618,-0.0139,0.1374,RMC
JHMM,John Hancock Multi-Factor Mid Cap ETF,Russell Midcap real-time,23.39,0.0618,-0.0139,0.1374,RMC
VO,Vanguard Mid-Cap ETF,Russell Midcap real-time,23.39,0.0618,-0.0139,0.1374,RMC
IWS,iShares Russell Mid-Cap Value ETF,Russell Midcap Value,19.54,0.0423,-0.0508,0.1355,RMV
IWM,iShares Russell 2000 ETF,Russell 2000,19.27,0.1025,0.0283,0.1774,RTY
VTWO,Vanguard Russell 2000 ETF,Russell 2000,19.27,0.1025,0.0283,0.1774,RTY
IWN,iShares Russell 2000 Value ETF,Russell 2000 Value,15.05,0.0999,0.0209,0.1781,RUJ
VTWV,Vanguard Russell 2000 Value,Russell 2000 Value,15.05,0.0999,0.0209,0.1781,RUJ
PSCD,Invesco S&P SmallCap Consumer Discretionary ETF,S&P 600 Consumer Discretionary Sector,12.89,0.2207,0.1059,0.3356,S6COND
PSCT,Invesco S&P SmallCap Information Technology ETF,S&P 600 Information Technology Sector,35.1,0.0677,-0.036,0.1717,S6INFT
XOUT,GraniteShares XOUT US Large Cap ETF,S&P 500 Growth,40.48,0.0466,-0.0842,0.1769,SGX
IJR,iShares Core S&P Small-Cap ETF,S&P Small Cap 600,17.98,0.1736,0.1051,0.2411,SML
FYX,First Trust Small Cap Core AlphaDEX Fund,S&P Small Cap 600,17.98,0.1736,0.1051,0.2411,SML
SLY,SPDR S&P 600 Small CapETF,S&P Small Cap 600,17.98,0.1736,0.1051,0.2411,SML
SPSM,SPDR Portfolio S&P 600 Small Cap ETF,S&P Small Cap 600,17.98,0.1736,0.1051,0.2411,SML
VIOO,Vanguard S&P Small-Cap 600 ETF,S&P Small Cap 600,17.98,0.1736,0.1051,0.2411,SML
IJT,iShares S&P Small-Cap 600 Growth ETF,S&P Small Cap 600 Growth,24.16,0.1787,0.1059,0.2528,SMLG
SLYG,SPDR S&P 600 Small Cap Growth ETF,S&P Small Cap 600 Growth,24.16,0.1787,0.1059,0.2528,SMLG
VIOG,Vanguard S&P Small-Cap 600 Growth ETF,S&P Small Cap 600 Growth,24.16,0.1787,0.1059,0.2528,SMLG
IJS,iShares S&P Small-Cap 600 Value ETF,S&P Small Cap 600 Value,14.97,0.1549,0.0903,0.2197,SMLV
SLYV,SPDR S&P 600 Small CapValue ETF,S&P Small Cap 600 Value,14.97,0.1549,0.0903,0.2197,SMLV
VIOV,Vanguard S&P Small-Cap 600 Value ETF,S&P Small Cap 600 Value,14.97,0.1549,0.0903,0.2197,SMLV
SMH,VanEck Semiconductor ETF,Philadelphia Stock Exchange Semiconductor,32.94,0.0865,-0.1255,0.2963,SOX
SOXX,iShares Semiconductor ETF,Philadelphia Stock Exchange Semiconductor,32.94,0.0865,-0.1255,0.2963,SOX
XHB,SPDR S&P Homebuilders ETF,S&P Homebuilding Select Industry,19.98,0.0394,-0.2199,0.2988,SPSIHO
XME,SPDR S&P Metals & Mining ETF,S&P Metals and Mining Select Industry,16.36,0.0251,-0.2601,0.3096,SPSIMM
SSPY,Syntax Stratified Large Cap ETF,S&P 500 Equal Weighted,22.07,0.0557,-0.0072,0.1184,SPW
ESGU,iShares ESG Aware MSCI USA ETF,S&P 500 INDEX,27.14,0.0176,-0.093,0.127,SPX
BBUS,JPMorgan BetaBuilders US Equity ETF,S&P 500 INDEX,27.14,0.0176,-0.093,0.127,SPX
ILCB,iShares Morningstar US Equity ETF,S&P 500 INDEX,27.14,0.0176,-0.093,0.127,SPX
GSUS,Goldman Sachs MarketBeta US Equity ETF,S&P 500 INDEX,27.14,0.0176,-0.093,0.127,SPX
ITOT,iShares Core S&P Total US Stock Market ETF,S&P 500 INDEX,27.14,0.0176,-0.093,0.127,SPX
IVV,iShares Core S&P 500 ETF,S&P 500 INDEX,27.14,0.0176,-0.093,0.127,SPX
IWB,iShares Russell 1000 ETF,S&P 500 INDEX,27.14,0.0176,-0.093,0.127,SPX
IWL,iShares Russell Top 200 ETF,S&P 500 INDEX,27.14,0.0176,-0.093,0.127,SPX
JUST,Goldman Sachs JUST US Large Cap Equity ETF,S&P 500 INDEX,27.14,0.0176,-0.093,0.127,SPX
IYY,iShares Dow Jones U.S. ETF,S&P 500 INDEX,27.14,0.0176,-0.093,0.127,SPX
IWV,iShares Russell 3000 ETF,S&P 500 INDEX,27.14,0.0176,-0.093,0.127,SPX
JHML,John Hancock Multi-Factor Large Cap ETF,S&P 500 INDEX,27.14,0.0176,-0.093,0.127,SPX
OVL,Overlay Shares Large Cap Equity ETF,S&P 500 INDEX,27.14,0.0176,-0.093,0.127,SPX
SCHK,Schwab 1000 Index ETF,S&P 500 INDEX,27.14,0.0176,-0.093,0.127,SPX
SCHX,Schwab US Large-Cap ETF,S&P 500 INDEX,27.14,0.0176,-0.093,0.127,SPX
SNPE,Xtrackers S&P 500 ESG ETF,S&P 500 INDEX,27.14,0.0176,-0.093,0.127,SPX
SPLG,SPDR Portfolio S&P 500 ETF,S&P 500 INDEX,27.14,0.0176,-0.093,0.127,SPX
SPY,SPDR S&P 500 ETF Trust,S&P 500 INDEX,27.14,0.0176,-0.093,0.127,SPX
SPYX,SPDR S&P 500 Fossil Fuel Reserves Free ETF,S&P 500 INDEX,27.14,0.0176,-0.093,0.127,SPX
VTI,Vanguard Total Stock Market ETF,S&P 500 INDEX,27.14,0.0176,-0.093,0.127,SPX
VV,Vanguard Large-Cap ETF,S&P 500 INDEX,27.14,0.0176,-0.093,0.127,SPX
SCHB,Schwab US Broad Market ETF,S&P 500 INDEX,27.14,0.0176,-0.093,0.127,SPX
VONE,Vanguard Russell 1000,S&P 500 INDEX,27.14,0.0176,-0.093,0.127,SPX
VOO,Vanguard S&P 500 ETF,S&P 500 INDEX,27.14,0.0176,-0.093,0.127,SPX
IUSV,iShares Core S&P U.S. Value ETF,S&P 500 Value,21.22,-0.0239,-0.1113,0.0638,SVX
IVE,iShares S&P 500 Value ETF,S&P 500 Value,21.22,-0.0239,-0.1113,0.0638,SVX
SPYV,SPDR Portfolio S&P 500 Value ETF,S&P 500 Value,21.22,-0.0239,-0.1113,0.0638,SVX
VOOV,Vanguard S&P 500 Value ETF,S&P 500 Value,21.22,-0.0239,-0.1113,0.0638,SVX
